metric,value,category
Animals transported within eight hours or less - Broilers,100%,Animal Welfare
Animals stunned prior to slaughter - Beef,100%,Animal Welfare
Animals stunned prior to slaughter - Dairy cattle,100%,Animal Welfare
Animals stunned prior to slaughter - Turkeys,100%,Animal Welfare
Animals stunned prior to slaughter - Broilers,100%,Animal Welfare
Cattle slips,100%,Animal Welfare
Cattle falls,99.7%,Animal Welfare
Turkeys meet outcomes of composite welfare index from National Turkey Federation,More than 97%,Animal Welfare
Broilers free from footpad dermatitis,83%,Animal Welfare
Tankers of egg product independently audited for animal welfare standards,100%,Animal Welfare
